{
  "$schema": "../../deploy/games-manifest.schema.json",
  "slug": "piggy-bank-panic",
  "title": "Piggy Bank Panic",
  "category": "money",
  "short_description": "Penny the piggy bank can't keep count! Count coins, check what you can afford, and work out the change.",
  "description": "Penny the piggy bank is in a PANIC — her owner keeps buying things and she can't keep count of the grin coins (ツ) rattling around inside her! Count the coins she swallowed, check whether the skateboard is affordable, work out the change from a ツ10 note, and figure out how many weeks of saving it takes to reach the kite. Answer wrong and Penny faints dramatically. Younger players count coins and simple spending; older players handle decimal change and multi-item purchases. Every puzzle is freshly generated. A free online money, saving and financial-literacy game for kids in grades 1–5, with speed and streak bonuses feeding your score and GP.",
  "game_type": "html5",
  "entry": "index.html",
  "thumbnail": "thumbnail.png",
  "width": 960,
  "height": 620,
  "controls": "Mouse / tap the right amount before the timer runs out.",
  "tags": [
    "money",
    "financial-literacy",
    "saving",
    "coins",
    "change",
    "grin",
    "strand-money",
    "grade-1",
    "grade-2",
    "grade-3",
    "grade-4",
    "grade-5",
    "kids",
    "funny"
  ],
  "is_mobile_compatible": true,
  "api_enabled": true,
  "is_active": true,
  "is_featured": false,
  "import_id": "edu:piggy-bank-panic"
}
