{
  "$schema": "../../deploy/games-manifest.schema.json",
  "slug": "great-guesstimator",
  "title": "The Great Guess-timator",
  "category": "math",
  "short_description": "Estimate FAST — jellybean jars and rough sums. Close guesses make the crowd gasp; wild ones make the turban spin.",
  "description": "Madame Approximata, the carnival mind-reader, challenges you to estimate FAST: how many jellybeans in the jar? ROUGHLY what is 48 + 53? There's no time to count — slide to your best guess before the timer runs out. The closer you are, the louder the crowd gasps; wildly wrong guesses make her turban spin. Grade bands ramp from small jars and easy sums to huge jars and multiplication estimates. A free online estimation and number-sense game for kids in grades 1–5 — closeness scoring means every round earns points that feed your score and GP.",
  "game_type": "html5",
  "entry": "index.html",
  "thumbnail": "thumbnail.png",
  "width": 960,
  "height": 640,
  "controls": "Drag the slider to your estimate, then press Lock in my guess before the timer runs out.",
  "tags": [
    "math",
    "estimation",
    "number-sense",
    "strand-number",
    "grade-1",
    "grade-2",
    "grade-3",
    "grade-4",
    "grade-5",
    "kids",
    "funny"
  ],
  "is_mobile_compatible": true,
  "api_enabled": true,
  "is_active": true,
  "is_featured": false,
  "import_id": "edu:great-guesstimator"
}
