{
  "$schema": "../../deploy/games-manifest.schema.json",
  "slug": "pair-a-dice-pets",
  "title": "Pair-a-Dice Pets",
  "category": "memory",
  "short_description": "Study the pets on the shelf, then answer: which one vanished, which snuck in, how many were there?",
  "description": "The pets at the Pair-a-Dice Pet Shop love to play tricks! Study the pets on the shelf while the clock ticks down, and when they hide, remember what you saw. Then answer the challenge: which pet vanished, which sneaky newcomer snuck in, how many pets were there, or which pet was in a certain spot? It's a Kim's-game style memory workout that trains observation, visual memory and attention. Younger players get fewer pets and a longer look; older players face a crowded shelf and only a quick peek. A free online memory and observation brain-training game for kids in grades 1–5, with speed and streak bonuses feeding your score and GP.",
  "game_type": "html5",
  "entry": "index.html",
  "thumbnail": "thumbnail.png",
  "width": 960,
  "height": 660,
  "controls": "Watch the shelf, then mouse / tap the pet (or number) that answers the challenge.",
  "tags": [
    "memory",
    "observation",
    "brain-training",
    "attention",
    "concentration",
    "strand-memory",
    "grade-1",
    "grade-2",
    "grade-3",
    "grade-4",
    "grade-5",
    "kids",
    "funny"
  ],
  "is_mobile_compatible": true,
  "api_enabled": true,
  "is_active": true,
  "is_featured": false,
  "import_id": "edu:pair-a-dice-pets"
}
