{
  "$schema": "../../deploy/games-manifest.schema.json",
  "slug": "primary-source-sleuth",
  "title": "Primary Source Sleuth",
  "category": "history",
  "short_description": "Detective work with history: is this clue a PRIMARY source made at the time, or a SECONDARY source made later about it? Grab your magnifying glass.",
  "description": "Real historians are detectives, and the first question they ask about any clue is: where did this come from? In each case you're shown a source — a soldier's diary, a school textbook, an old photograph, a modern documentary, an ancient coin — and you decide whether it's a PRIMARY source (first-hand, from the time it happened) or a SECONDARY source (made later, telling us about it). It teaches the historical-thinking skill behind every history lesson: evaluating evidence, spotting first-hand accounts, and understanding why the source matters. Grade bands ramp from obvious objects, to letters and encyclopedias, to tricky edge cases like interviews and autobiographies. Correct verdicts and streaks earn bonus points. A free online sources, evidence and historical-thinking game for kids in grades 1–5, feeding your score and GP on OnlyGrins.",
  "game_type": "html5",
  "entry": "index.html",
  "width": 960,
  "height": 600,
  "thumbnail": "thumbnail.png",
  "controls": "Mouse / tap PRIMARY or SECONDARY for each source.",
  "tags": [
    "history",
    "primary-source",
    "secondary-source",
    "historical-thinking",
    "evidence",
    "sources",
    "grade-1",
    "grade-2",
    "grade-3",
    "grade-4",
    "grade-5",
    "kids",
    "funny"
  ],
  "is_mobile_compatible": true,
  "api_enabled": true,
  "is_active": true,
  "is_featured": false,
  "import_id": "edu:primary-source-sleuth"
}
