{
  "$schema": "../../deploy/games-manifest.schema.json",
  "slug": "subroutine-squirrels",
  "title": "Subroutine Squirrels",
  "category": "coding",
  "short_description": "Teach the squirrel one little trick, give it a name, then CALL it again and again to reach the acorn stash. Fewer blocks, more points — that's the power of functions.",
  "description": "Sandy the squirrel has a long, repetitive path to the acorn stash. Instead of tapping the same moves over and over, you define a reusable trick inside the function f() once, then drop CALL f() blocks into the main program to run it as many times as you need. It's real computer-science thinking one step beyond loops: abstraction — bundling a sequence of steps under a name and reusing it. Hit Run and watch Sandy walk your program, debugging when she bonks a wall. Grade bands ramp from a two-move function called a couple of times, to longer tricks with turns, to bigger maps that mix a function with a few extra main-program moves. Shorter, tidier programs earn a big brevity bonus. A free online functions, procedures and algorithms coding game for kids in grades 1–5, feeding your score and GP on OnlyGrins.",
  "game_type": "html5",
  "entry": "index.html",
  "width": 960,
  "height": 640,
  "thumbnail": "thumbnail.png",
  "controls": "Mouse / tap arrows to fill the function and main program, add CALL f() blocks, then Run.",
  "tags": [
    "coding",
    "functions",
    "procedures",
    "abstraction",
    "algorithms",
    "strand-functions",
    "grade-1",
    "grade-2",
    "grade-3",
    "grade-4",
    "grade-5",
    "kids",
    "funny"
  ],
  "is_mobile_compatible": true,
  "api_enabled": true,
  "is_active": true,
  "is_featured": false,
  "import_id": "edu:subroutine-squirrels"
}
